{
  "$schema": "https://json-schema.org/draft/2020-12/schema",
  "$id": "https://legal-content.codepackr.com/schemas/content-envelope.schema.json",
  "title": "Legal Content Envelope",
  "type": "object",
  "required": ["schemaVersion", "entityType", "id", "version", "status", "title", "jurisdiction", "content", "sources", "updatedAt"],
  "properties": {
    "schemaVersion": { "type": "string", "pattern": "^v[0-9]+$" },
    "entityType": { "type": "string", "enum": ["topic", "provision", "judgment", "doctrine", "comparison", "illustration", "source", "collection"] },
    "id": { "type": "string", "pattern": "^[a-z0-9-]+:[a-z0-9-]+:[a-z0-9._-]+$" },
    "version": { "type": "integer", "minimum": 1 },
    "status": { "type": "string", "enum": ["draft", "research", "review", "verified", "approved", "published", "review-due", "update", "archived"] },
    "title": { "type": "string", "minLength": 1 },
    "jurisdiction": { "type": "string", "minLength": 1 },
    "content": { "type": "object" },
    "sources": { "type": "array", "items": { "type": "string" } },
    "updatedAt": { "type": "string", "format": "date-time" },
    "effectiveFrom": { "type": ["string", "null"], "format": "date" },
    "effectiveTo": { "type": ["string", "null"], "format": "date" },
    "tags": { "type": "array", "items": { "type": "string" } }
  },
  "additionalProperties": false
}