{
  "schemaVersion": "v1",
  "entityType": "topic",
  "id": "topic:india:bnss-s-179",
  "version": 1,
  "status": "published",
  "title": "BNSS s",
  "jurisdiction": "India",
  "content": {
    "overview": "BNSS s. 179, Police officer\u2019s power to require attendance of witnesses, is a procedural provision in the Information to the police and their powers to investigate cluster. Apply its conditions in sequence, identify the competent criminal court and remedy, and check the s. 531 transition rule before using BNSS or the saved CrPC.",
    "study": "Current-law identity\nBNSS s. 179 governs police officer\u2019s power to require attendance of witnesses within Chapter XIII - Information to the police and their powers to investigate. The provision must be read with its enacted sub-sections, provisos, explanations, the BNSS First Schedule where classification or trial forum is relevant, and BNSS s. 178, BNSS s. 180.\n\nProcedural meaning and legislative purpose\nCriminal procedure is a sequence of safeguards, not a collection of isolated powers. This section allocates a procedural step to the police, Magistrate, trial court, Sessions Court or High Court and places conditions around its exercise. The mischief addressed is identified from the statutory text and Chapter setting; the court should not add a condition that the legislature did not enact or remove a safeguard that the text requires.\n\nMandatory application checklist\n1. Identify the proceeding, procedural stage and order sought.\n2. Confirm whether the investigation, inquiry, trial, application or appeal was pending immediately before 1 July 2024. If so, begin with BNSS s. 531(2)(a) and test whether the saved CrPC route governs.\n3. Quote the exact operative words of s. 179, including every condition, proviso and explanation.\n4. Identify the competent criminal court, territorial rule, statutory sanction or classification requirement.\n5. Map each material fact to the statutory condition it proves or fails.\n6. State the immediate remedy and the standard for interference.\n\nEvidence and constitutional control\nThe procedural record remains subject to Articles 14, 20, 21 and 22 of the Constitution. The party asserting a factual foundation bears the ordinary burden under BSA s. 104; BSA s. 106 is limited to facts especially within a person's knowledge after the foundation is established. Electronic records must be separately tested under BSA s. 63 for the applicable certificate and production requirements. BSA admissibility does not cure an unlawful arrest, search, remand or other BNSS defect.\n\nCourtroom method\nIn a written submission, state the current section first, identify the stage and forum, reproduce only the necessary statutory language, address the transition rule, apply each condition to the record, answer the principal objection, and request a precise order. Do not treat a police report as proof of guilt, an arrest as a conviction, a charge as a finding, or a procedural irregularity as automatically destroying the entire prosecution.",
    "relatedTopics": [],
    "illustrations": [],
    "legacySubjectSlug": "bnss",
    "legacyTopicId": "s-179",
    "provenance": "Migrated from the existing codepackr-law topic file. Text was not rewritten."
  },
  "sources": [
    "source:india:india-code-bnss-2023"
  ],
  "updatedAt": "2026-10-02T08:45:00Z",
  "effectiveFrom": "1950-01-26",
  "effectiveTo": null
}
