{
  "schemaVersion": "v1",
  "entityType": "illustration",
  "id": "illustration:india:arbitration-arbitration-lsaa-s-20-21-example",
  "version": 1,
  "status": "review",
  "title": "LSA Act ss. 20 & 21 \u2014 Award of Lok Adalat (Deemed Civil Court decree, non-appealable) (LSA Act ss. 20-21) - teaching pattern",
  "jurisdiction": "India",
  "content": {
    "type": "example",
    "body": "Educational hypothetical, not an official statutory illustration and not a new decided case. Use only the law already recorded in this topic file. Facts already recorded in this topic file: The Court considered arbitrability and the role of the referral court. Issue already recorded: When should a court refer parties to arbitration and which disputes are non-arbitrable? Recorded ingredient used: LSA Act ss. 20 & 21 \u2014 Award of Lok Adalat (Deemed Civil Court decree, non-appealable) (LSA Act ss. 20-21) sits within ADR & Arbitration and is governed by Arbitration and Conciliation Act, 1996; Mediation Act, 2023; Legal Services Authorities Act, 1987. Explain the legal mischie... Application: a person affected by LSA Act ss. 20 & 21 \u2014 Award of Lok Adalat (Deemed Civil Court decree, non-appealable) (LSA Act ss. 20-21) places only those recorded facts before the forum already named in this file. Match each recorded ingredient. Where every recorded ingredient is present, the recorded rule applies and the result stops at that rule. Authority already recorded in this file, not a new citation: Vidya Drolia v. Durga Trading Corporation (2021) 2 SCC 1. Use it only as already written here.",
    "parentId": "topic:india:adr-lsaa-s-20-21",
    "officialStatutoryIllustration": false,
    "subject": "arbitration"
  },
  "sources": [],
  "updatedAt": "2026-10-04T09:58:38.049Z"
}
