{
  "schemaVersion": "v1",
  "entityType": "topic",
  "id": "topic:india:constitution-art-243k",
  "version": 2,
  "status": "review",
  "title": "Article 243K — Elections to the Panchayats",
  "jurisdiction": "India",
  "content": {
    "overview": "Article 243K provides that the superintendence, direction and control of the preparation of electoral rolls for, and the conduct of, all elections to the Panchayats shall be vested in a State Election Commission consisting of a State Election Commissioner appointed by the Governor. The SEC’s conditions of service and tenure are as the Governor may by rule determine; they shall not be varied to disadvantage after appointment. The State Election Commissioner may be removed only in like manner and on like grounds as a Judge of a High Court. Subject to Part IX, the State Legislature may by law make provision for all matters relating to Panchayat elections.",
    "glance": "State Election Commission (SEC) conducts Panchayat elections. SEC appointed by Governor; removal like High Court Judge; conditions not varied to disadvantage. State law may regulate election matters subject to Part IX.",
    "study": "Article 243K Panchayat elections:\n1. Superintendence, direction and control of electoral rolls and conduct of Panchayat elections vested in **State Election Commission**.\n2. State Election Commissioner appointed by the **Governor**.\n3. Conditions of service/tenure by Governor’s rule; not varied to disadvantage after appointment.\n4. Removal only in like manner and on like grounds as a **High Court Judge**.\n5. State Legislature may by law provide for matters relating to Panchayat elections (subject to Part IX).\n\nExamination: SEC not ECI; Governor appoints; HC Judge-level removal; contrast Art 324.\n\nArticle 243K — State Election Commission independence and election control\nArticle 243K vests superintendence, direction and control of Panchayat electoral rolls and elections in the State Election Commission (SEC). The State Election Commissioner is appointed by the Governor and can be removed only in the same manner and on the same grounds as a High Court Judge; service conditions cannot be varied to the officer's disadvantage after appointment. State legislation may regulate election details subject to Part IX. When election administration is challenged, separate SEC constitutional independence, state-law procedural rules and the Article 243O restriction on election challenges. Preserve the election notification, rolls, delimitation record and SEC directions to identify the precise alleged illegality.",
    "sections": [
      {
        "heading": "Key rules",
        "body": "1. SEC: superintendence, direction and control of Panchayat elections.\n2. Appointed by Governor; conditions not varied to disadvantage.\n3. Removal like a High Court Judge.\n4. State law may regulate election matters subject to Part IX.",
        "order": 1
      },
      {
        "heading": "Article 243K — State Election Commission independence and election control",
        "body": "Article 243K vests superintendence, direction and control of Panchayat electoral rolls and elections in the State Election Commission (SEC). The State Election Commissioner is appointed by the Governor and can be removed only in the same manner and on the same grounds as a High Court Judge; service conditions cannot be varied to the officer's disadvantage after appointment. State legislation may regulate election details subject to Part IX. When election administration is challenged, separate SEC constitutional independence, state-law procedural rules and the Article 243O restriction on election challenges. Preserve the election notification, rolls, delimitation record and SEC directions to identify the precise alleged illegality.",
        "order": 2
      }
    ],
    "questionsAndAnswers": [
      {
        "id": "art-243k-brief",
        "draftingCategory": "brief",
        "question": "Who conducts elections to the Panchayats under Article 243K?",
        "answer": "Under Article 243K, the superintendence, direction and control of the preparation of electoral rolls for, and the conduct of, all elections to the Panchayats are vested in a State Election Commission consisting of a State Election Commissioner appointed by the Governor. The State Election Commissioner may be removed only in like manner and on like grounds as a Judge of a High Court. The conditions of service of the State Election Commissioner shall not be varied to his disadvantage after appointment. Subject to Part IX, the Legislature of a State may by law make provision with respect to all matters relating to elections to the Panchayats.",
        "relatedProvisionIds": [
          "constitution-article-243k"
        ]
      }
    ],
    "cases": [],
    "bareActPointers": [
      "Article 243K"
    ],
    "examTips": [
      "State Election Commission; Governor appoints; removal like HC Judge."
    ],
    "legacySubjectSlug": "constitution",
    "legacyTopicId": "art-243k",
    "migrationNote": "QUAL remediation 2026-10-09.",
    "enhancement": {
      "version": "1.2.0",
      "status": "in-progress",
      "coverage": "substantive-topic-specific-v1",
      "caseLaw": [],
      "authoritativeSources": [
        "Constitution of India — Article 243K"
      ],
      "verification": {
        "lastVerifiedAt": null,
        "verifiedBy": null,
        "notes": [
          "Text verified."
        ]
      },
      "keyTakeaways": [
        "Art 243K: State Election Commission for Panchayat elections."
      ],
      "examAnswerStructure": {
        "shortAnswer": [
          "State art-243k",
          "Identify elements",
          "Conclude"
        ],
        "tenMark": [
          "Text / rule",
          "Elements",
          "Application"
        ],
        "sixteenMark": [
          "Full framework",
          "Elements",
          "Application",
          "Conclusion"
        ]
      },
      "detailedExplanation": "Article 243K provides that the superintendence, direction and control of the preparation of electoral rolls for, and the conduct of, all elections to the Panchayats shall be vested in a State Election Commission consisting of a State Election Commissioner appointed by the Governor. The SEC’s conditions of service and tenure are as the Governor may by rule determine; they shall not be varied to disadvantage after appointment. The State Election Commissioner may be removed only in like manner and on like grounds as a Judge of a High Court. Subject to Part IX, the State Legislature may by law make provision for all matters relating to Panchayat elections."
    },
    "examples": [
      {
        "title": "Application of art-243k",
        "body": "Facts that satisfy the elements stated in the provision produce the consequence described in the text."
      }
    ],
    "hypotheticals": [
      {
        "question": "Do the facts engage art-243k?",
        "analysis": "Compare the facts with the statutory or constitutional elements stated in the text."
      }
    ],
    "distinctions": [
      {
        "title": "Scope of art-243k",
        "body": "Applies only within the elements and consequences stated in the constitutional text."
      }
    ],
    "misconceptions": [
      {
        "myth": "art-243k creates unlimited or extra-textual rights.",
        "correction": "It operates only as stated in the constitutional provision."
      }
    ],
    "revisionPoints": [
      "Core rule of art-243k",
      "Elements",
      "Consequence"
    ]
  },
  "sources": [
    "source:india:india-code-constitution"
  ],
  "updatedAt": "2026-10-09T05:05:00.000Z",
  "effectiveFrom": null,
  "effectiveTo": null,
  "tags": [
    "constitution",
    "panchayats",
    "elections",
    "review-required"
  ]
}
