{
  "schemaVersion": "v1",
  "entityType": "illustration",
  "id": "illustration:india:admin-admin-admin-separation-comparative-example",
  "version": 1,
  "status": "review",
  "title": "Separation of Powers under Different Constitutions - teaching pattern",
  "jurisdiction": "India",
  "content": {
    "type": "example",
    "body": "Educational hypothetical, not an official statutory illustration and not a new decided case. Use only the law already recorded in this topic file. Facts already recorded in this topic file: The selection process involved decision-makers whose interests overlapped with the candidates. Issue already recorded: How far do natural justice rules apply to administrative action? Recorded ingredient used: Separation of Powers under Different Constitutions sits within Administrative Law and is governed by constitutional judicial review, administrative law principles, delegated legislation and Lokpal and Lokayuktas Act, 2013. Explain the legal mischief, institutional purpose and co... Application: a person affected by Separation of Powers under Different Constitutions places only those recorded facts before the forum already named in this file. Match each recorded ingredient. Where every recorded ingredient is present, the recorded rule applies and the result stops at that rule. Authority already recorded in this file, not a new citation: A.K. Kraipak v. Union of India (1969) 2 SCC 262. Use it only as already written here.",
    "parentId": "topic:india:admin-separation-comparative",
    "officialStatutoryIllustration": false,
    "subject": "admin"
  },
  "sources": [],
  "updatedAt": "2026-10-04T06:27:16.233Z"
}
