{
  "schemaVersion": "v1",
  "entityType": "topic",
  "id": "topic:india:constitution-art-14",
  "version": 1,
  "status": "published",
  "title": "Article 14 — Equality before law",
  "jurisdiction": "India",
  "content": {
    "overview": "Article 14 of the Constitution of India forbids the State from denying equality before the law or the equal protection of the laws. Classification must rest on an intelligible differentia that bears a rational relation to the object sought.",
    "study": "Article 14 has two limbs: equality before the law and equal protection of the laws. Modern review also asks whether State action is arbitrary. Classification is permitted. Class legislation is not. After Maneka, Article 14 also informs the fairness of procedure under Article 21.\n\nPractice: identify the class, the differentia, the object of the law, and the nexus. Then ask whether the measure is arbitrary in operation.",
    "sections": [
      {"heading": "Text", "body": "The State shall not deny to any person equality before the law or the equal protection of the laws within the territory of India.", "order": 1},
      {"heading": "Practice point", "body": "Do not plead Article 14 as a slogan. Plead the class, the object, and why the differentia fails or why the action is arbitrary.", "order": 2}
    ],
    "relatedJudgments": ["judgment:india:maneka-gandhi-1978", "judgment:india:minerva-mills-1980"],
    "relatedTopics": ["topic:india:constitution-art-21"],
    "illustrations": [],
    "legacySubjectSlug": "constitution",
    "legacyTopicId": "art-14"
  },
  "sources": ["source:india:india-code-constitution"],
  "updatedAt": "2026-09-30T20:15:00Z",
  "effectiveFrom": "1950-01-26",
  "effectiveTo": null
}
