{
    "schemaVersion": "v1",
    "entityType": "topic",
    "id": "topic:india:contract-s-44",
    "version": 2,
    "status": "review",
    "title": "Indian Contract Act, 1872 — Section 44 (Effect of release of one joint promisor)",
    "jurisdiction": "India",
    "content": {
        "overview": "Section 44 provides that where two or more persons have made a joint promise, a release of one of such joint promisors by the promisee does not discharge the other joint promisor or joint promisors; neither does it free the joint promisor so released from responsibility to the other joint promisor or joint promisors.",
        "glance": "Release of one joint promisor does not discharge the others; released promisor remains responsible to the other joint promisors.",
        "study": "A release by the promisee of one joint promisor does not discharge the other joint promisor(s). The released promisor also remains responsible to the other joint promisor(s) (e.g. for contribution). Current-law framing: identify release of one joint promisor; apply non-discharge of the others; apply continuing responsibility of the released promisor inter se.",
        "sections": [{"heading": "Others not discharged", "body": "Release of one joint promisor by the promisee does not discharge the other joint promisor or joint promisors.", "order": 1}, {"heading": "Released promisor still responsible inter se", "body": "Does not free the released joint promisor from responsibility to the other joint promisor or joint promisors.", "order": 2}],
        "provisions": [{"actId": "indian-contract-act-1872", "actName": "Indian Contract Act, 1872", "provisionId": "ica-s-44", "section": "Section 44", "title": "Effect of release of one joint promisor"}],
        "examples": [{"title": "Release of one of three", "body": "A, B and C jointly promise to pay D. D releases A. B and C remain liable to D; A remains responsible to B and C inter se under s. 44.", "kind": "hypothetical", "inventedCase": false}],
        "hypotheticals": [{"question": "Does releasing one joint promisor free everyone?", "analysis": "No. Section 44: the others remain liable to the promisee, and the released promisor remains responsible to the other joint promisors."}],
        "distinctions": [],
        "misconceptions": [{"id": "ica-s44-trap-1", "trap": "Release of one joint promisor discharges all under common-law joint obligation rules.", "correction": "Section 44 expressly preserves the liability of the other joint promisors and inter se responsibility of the released promisor."}],
        "cases": [],
        "questionsAndAnswers": [{"id": "ica-s44-brief", "draftingCategory": "brief", "question": "How should a Section 44 problem be analysed?", "answer": "I. Identify release of one joint promisor. II. Apply non-discharge of others. III. Apply continuing inter se responsibility. IV. Conclude.", "explanation": "IRAC."}],
        "bareActPointers": ["Indian Contract Act, 1872 — Section 44", "Connected: Sections 42, 43"],
        "examTips": ["State both limbs: others not discharged; released still responsible inter se."],
        "revisionPoints": ["Others not discharged", "Released promisor still responsible inter se"],
        "relatedJudgments": [],
        "relatedTopics": ["contract-s-43", "contract-s-45"],
        "illustrations": [],
        "legacySubjectSlug": "contract",
        "legacyTopicId": "s-44",
        "migrationNote": "Substantive expansion from catalog stub. Forward bulk 2026-10-15.",
        "enhancement": {"version": "2", "status": "verification_in_progress", "coverage": "substantive-topic-specific-v1", "definition": "Section 44 provides that release of one joint promisor does not discharge the others or free the released promisor from inter se responsibility.", "legalPrinciple": "Release of one does not discharge the rest; inter se responsibility continues.", "statutoryFramework": "Indian Contract Act, 1872 — Section 44", "essentialIngredients": ["Others not discharged", "Released promisor still responsible inter se"], "authoritativeSources": ["Indian Contract Act, 1872 (Act 9 of 1872), section 44"], "verification": {"status": "SOURCE_CHECK_REQUIRED", "note": "2026-10-15 forward-order source check. Not COMPLETE_LOCKED.", "date": "2026-10-15", "reviewer": "current-assistant-contract-forward-s44"}, "caseLawGate": "standard-citations-added-not-locked", "lastBotRunAt": "2026-10-15T12:58:00.000Z", "bot": "manual-quality-remediation", "sourceFingerprint": "ica-s44-2026-10-15", "indiaCode": {"act": "Indian Contract Act, 1872 (Act 9 of 1872)", "handle": "https://www.indiacode.nic.in/handle/123456789/2187", "note": "Verified against official text. Not a verified closure."}},
        "caseLawGate": "standard-citations-added-not-locked"
    },
    "sources": ["source:india:india-code-contract-1872"],
    "updatedAt": "2026-10-15T12:58:00.000Z",
    "effectiveFrom": null,
    "effectiveTo": null,
    "tags": ["contract", "indian-contract-act-1872", "section-44", "joint", "review-required"]
}
