{
  "schemaVersion": "v1",
  "entityType": "topic",
  "id": "topic:india:constitution-art-305",
  "version": 2,
  "status": "review",
  "title": "Article 305 — Saving of existing laws and laws providing for State monopolies",
  "jurisdiction": "India",
  "content": {
    "overview": "Article 305 provides that nothing in Articles 301 and 303 shall affect the provisions of any existing law except in so far as the President may by order otherwise direct, and nothing in Article 301 shall affect the operation of any law made before the commencement of the Constitution (Seventh Amendment) Act, 1956, in so far as it relates to, or prevent Parliament or the State Legislature from making any law relating to, any such matter as is referred to in Article 19(6)(ii) (State monopoly for any trade, business, industry or service).",
    "glance": "Existing laws saved from Arts 301/303 unless President otherwise directs. State monopoly laws (Art 19(6)(ii) type) saved from Art 301; Parliament/States may still make such monopoly laws.",
    "study": "Article 305 savings:\n1. Existing laws: not affected by Arts 301 and 303 except as the President by order otherwise directs.\n2. State monopoly: Art 301 does not affect operation of pre-7th Amendment laws relating to State monopolies of the kind in Art 19(6)(ii), and does not prevent Parliament or States from making such monopoly laws.\n\nExamination: existing-law saving; Presidential order exception; State monopoly saving linked to Art 19(6)(ii).",
    "sections": [
      {
        "heading": "Savings",
        "body": "1. Existing laws unaffected by Arts 301 and 303 unless President by order otherwise directs.\n2. Art 301 does not bar State-monopoly type laws (Art 19(6)(ii)); such laws may continue and may be enacted.",
        "order": 1
      }
    ],
    "questionsAndAnswers": [
      {
        "id": "art-305-brief",
        "draftingCategory": "brief",
        "question": "What does Article 305 save?",
        "answer": "Article 305 provides that nothing in Articles 301 and 303 shall affect the provisions of any existing law except insofar as the President may by order otherwise direct. It also provides that nothing in Article 301 shall affect the operation of any law made before the Seventh Amendment relating to State monopolies of the kind referred to in Article 19(6)(ii), or prevent Parliament or a State Legislature from making any law relating to such a monopoly.",
        "relatedProvisionIds": [
          "constitution-article-305"
        ]
      }
    ],
    "cases": [],
    "bareActPointers": [
      "Article 305",
      "Article 19"
    ],
    "examTips": [
      "Existing laws saved; State monopoly laws saved from Art 301."
    ],
    "legacySubjectSlug": "constitution",
    "legacyTopicId": "art-305",
    "migrationNote": "QUAL remediation 2026-10-09.",
    "enhancement": {
      "version": "1.2.0",
      "status": "in-progress",
      "coverage": "substantive-topic-specific-v1",
      "caseLaw": [],
      "authoritativeSources": [
        "Constitution of India — Article 305"
      ],
      "verification": {
        "lastVerifiedAt": null,
        "verifiedBy": null,
        "notes": [
          "Text verified."
        ]
      },
      "keyTakeaways": [
        "Art 305: saving of existing laws and State monopoly laws."
      ],
      "examAnswerStructure": {
        "shortAnswer": [
          "State art-305",
          "Identify elements",
          "Conclude"
        ],
        "tenMark": [
          "Text / rule",
          "Elements",
          "Application"
        ],
        "sixteenMark": [
          "Full framework",
          "Elements",
          "Application",
          "Conclusion"
        ]
      },
      "detailedExplanation": "Article 305 provides that nothing in Articles 301 and 303 shall affect the provisions of any existing law except in so far as the President may by order otherwise direct, and nothing in Article 301 shall affect the operation of any law made before the commencement of the Constitution (Seventh Amendment) Act, 1956, in so far as it relates to, or prevent Parliament or the State Legislature from making any law relating to, any such matter as is referred to in Article 19(6)(ii) (State monopoly for any trade, business, industry or service)."
    },
    "examples": [
      {
        "title": "Application of art-305",
        "body": "Facts that satisfy the elements stated in the provision produce the consequence described in the text."
      }
    ],
    "hypotheticals": [
      {
        "question": "Do the facts engage art-305?",
        "analysis": "Compare the facts with the statutory or constitutional elements stated in the text."
      }
    ],
    "distinctions": [
      {
        "title": "Scope of art-305",
        "body": "Applies only within the elements and consequences stated in the constitutional text."
      }
    ],
    "misconceptions": [
      {
        "myth": "art-305 creates unlimited or extra-textual rights.",
        "correction": "It operates only as stated in the constitutional provision."
      }
    ],
    "revisionPoints": [
      "Core rule of art-305",
      "Elements",
      "Consequence"
    ]
  },
  "sources": [
    "source:india:india-code-constitution"
  ],
  "updatedAt": "2026-10-09T04:55:00.000Z",
  "effectiveFrom": null,
  "effectiveTo": null,
  "tags": [
    "constitution",
    "trade",
    "review-required"
  ]
}
