{
  "schemaVersion": "v1",
  "entityType": "topic",
  "id": "topic:india:company-company-preference-shares",
  "version": 1,
  "status": "review",
  "title": "Preference shares — issue and redemption",
  "jurisdiction": "India",
  "content": {
    "overview": "Section 55 allows preference shares redeemable within twenty years, or thirty years for infrastructure projects on the annual redemption conditions.",
    "glance": "Section 55 allows preference shares redeemable within twenty years, or thirty years for infrastructure projects on the annual redemption conditions.",
    "study": "Preference shares — issue and redemption. Section 55 allows preference shares redeemable within twenty years, or thirty years for infrastructure projects on the annual redemption conditions. State the trigger, the person who must comply, and the consequence in the section. A related section is a cross-reference, not a substitute for this rule. Not a verified closure.",
    "sections": [
      {
        "heading": "Principle",
        "body": "Section 55 allows preference shares redeemable within twenty years, or thirty years for infrastructure projects on the annual redemption conditions.",
        "order": 1
      },
      {
        "heading": "Explanation",
        "body": "Preference capital generally carries preferential dividend and a preferential return of capital. Irredeemable preference shares cannot be issued. Redemption is from profits available for dividend or a fresh issue, and a capital redemption reserve is created where redemption is from profits. Voting is limited under s. 47 except where dividend is in arrear for the stated period.",
        "order": 2
      },
      {
        "heading": "Ingredients",
        "body": "Redeemable only; Twenty or thirty year outer limit; Profits or fresh issue; Capital redemption reserve where required",
        "order": 3
      }
    ],
    "provisions": [
      {
        "actId": "company",
        "actName": "Companies Act, 2013, rules, tribunal procedure and principles of corporate personality, fiduciary governance and shareholder remedies",
        "provisionId": "company-company-preference-shares",
        "title": "Preference Shares, Bonus Shares and Rights Issue"
      },
      {
        "actId": "bsa",
        "actName": "Bharatiya Sakshya Adhiniyam, 2023",
        "provisionId": "bsa-s-63",
        "section": "s. 63",
        "title": "Electronic records where applicable"
      }
    ],
    "examples": [
      {
        "title": "Application",
        "body": "Preference capital generally carries preferential dividend and a preferential return of capital. Irredeemable preference shares cannot be issued. Redemption is from profits available for dividend or a fresh issue, and a capital redemption reserve is created where redemption is fr"
      }
    ],
    "hypotheticals": [
      {
        "title": "Apply the section",
        "body": "Preference shares — issue and redemption. Apply only the rule already stated: Section 55 allows preference shares redeemable within twenty years, or thirty years for infrastructure projects on the annual redemption conditions."
      }
    ],
    "distinctions": [
      "Redeemable only",
      "Twenty or thirty year outer limit",
      "Profits or fresh issue",
      "Capital redemption reserve where required"
    ],
    "misconceptions": [
      {
        "trap": "A generic company-law paragraph answers this topic.",
        "correction": "Section 55 allows preference shares redeemable within twenty years, or thirty years for infrastructure projects on the annual redemption conditions."
      }
    ],
    "cases": [],
    "questionsAndAnswers": [
      {
        "question": "Preference shares — issue and redemption?",
        "answer": "Section 55 allows preference shares redeemable within twenty years, or thirty years for infrastructure projects on the annual redemption conditions."
      }
    ],
    "bareActPointers": [
      "Companies Act, 2013, rules, tribunal procedure and principles of corporate personality, fiduciary governance and shareholder remedies",
      "Preference Shares, Bonus Shares and Rights Issue",
      "BSA s. 63 and ss. 104, 109 where relevant"
    ],
    "examTips": [
      "Name the governing section.",
      "Separate current law from omitted provisions."
    ],
    "revisionPoints": [
      "Section 55 allows preference shares redeemable within twenty years, or thirty years for infrastructure projects on the annual redemption conditions."
    ],
    "relatedJudgments": [
      {
        "name": "No section-specific judgment recorded",
        "citation": "",
        "point": "The operative rule is the section. No judgment is stated as the rule."
      }
    ],
    "relatedTopics": [
      "ca-s-43",
      "ca-s-55"
    ],
    "illustrations": [],
    "legacySubjectSlug": "company",
    "legacyTopicId": "company-preference-shares",
    "migrationNote": "Imported from the codepackr-law legacy topic catalog. Status is review until authoritative provenance and current-law verification are completed.",
    "enhancement": {
      "version": "2",
      "status": "verification_in_progress",
      "coverage": "substantive-topic-specific-v1",
      "definition": "Section 55 allows preference shares redeemable within twenty years, or thirty years for infrastructure projects on the annual redemption conditions.",
      "legalPrinciple": "Section 55 allows preference shares redeemable within twenty years, or thirty years for infrastructure projects on the annual redemption conditions.",
      "statutoryFramework": "Companies Act, 2013",
      "essentialIngredients": [
        "Redeemable only",
        "Twenty or thirty year outer limit",
        "Profits or fresh issue",
        "Capital redemption reserve where required"
      ],
      "detailedExplanation": "Preference shares — issue and redemption. Section 55 allows preference shares redeemable within twenty years, or thirty years for infrastructure projects on the annual redemption conditions. State the trigger, the person who must comply, and the consequence in the section. A related section is a cross-reference, not a substitute for this rule. Not a verified closure.",
      "examples": [
        "Section 55 allows preference shares redeemable within twenty years, or thirty years for infrastructure projects on the annual redemption conditions."
      ],
      "keyTakeaways": [
        "Redeemable only",
        "Twenty or thirty year outer limit",
        "Profits or fresh issue",
        "Capital redemption reserve where required"
      ],
      "authoritativeSources": [
        "Companies Act, 2013",
        "Companies Act, 2013 (Act 18 of 2013), India Code / MCA consolidated text",
        "https://www.indiacode.nic.in/bitstream/123456789/2114/5/A2013-18.pdf"
      ],
      "caseLaw": [
        {
          "name": "Preference shares — issue and redemption",
          "citation": "Companies Act, 2013",
          "point": "Section 55 allows preference shares redeemable within twenty years, or thirty years for infrastructure projects on the annual redemption conditions.",
          "kind": "statutory-pointer",
          "note": "Statutory pointer taken from the topic's operative rule. Not a judgment and not a primary-report verification."
        }
      ],
      "caseLawGate": "standard-citations-added-not-locked",
      "lastBotRunAt": "2026-10-09T20:30:00.000Z",
      "bot": "company-closure-batch-2026-10-09",
      "rules": [
        "No invented citations",
        "Not marked verified"
      ],
      "verification": {
        "status": "SOURCE_CHECKED_CASE_LAW_OPEN",
        "note": "Template citations removed where they were not the section rule.",
        "date": "2026-10-09"
      },
      "indiaCode": {
        "act": "Companies Act, 2013 (Act 18 of 2013)",
        "handle": "https://www.indiacode.nic.in/handle/123456789/2114",
        "pdf": "https://www.indiacode.nic.in/bitstream/123456789/2114/5/A2013-18.pdf",
        "sectionDeepLink": null,
        "note": "Act handle and official PDF attached. Section-level show-data links were not resolved. Not a verified closure."
      },
      "learningObjectives": [
        "State the rule recorded for Preference shares — issue and redemption.",
        "Separate the recorded rule, conditions, exceptions and application."
      ],
      "distinctions": [
        "Redeemable only",
        "Twenty or thirty year outer limit",
        "Profits or fresh issue",
        "Capital redemption reserve where required"
      ],
      "problemApplication": "Apply the section: Preference shares — issue and redemption. Apply only the rule already stated: Section 55 allows preference shares redeemable within twenty years, or thirty years for infrastructure projects on the annual redemption conditions.",
      "examAnswerStructure": "Identify the governing rule, ingredients, exceptions, forum or procedure, application to proved facts, authorities already recorded, and conclusion. Topic-specific legal verification remains required."
    },
    "caseLawGate": "standard-citations-added-not-locked"
  },
  "sources": [
    "source:india:india-code-companies-act-2013"
  ],
  "updatedAt": "2026-10-09T20:30:00.000Z",
  "effectiveFrom": null,
  "effectiveTo": null,
  "tags": [
    "legacy-migration",
    "review-required",
    "company"
  ]
}
