{
  "schemaVersion": "v1",
  "entityType": "topic",
  "id": "topic:india:constitution-art-8",
  "version": 2,
  "status": "review",
  "title": "Article 8 — Rights of citizenship of certain persons of Indian origin residing outside India",
  "jurisdiction": "India",
  "content": {
    "overview": "Article 8 enables a person of Indian origin ordinarily residing outside India to be registered as a citizen of India by the diplomatic or consular representative of India in the country of residence, if the person (or either parent or any grandparent) was born in undivided India (Government of India Act, 1935 definition).",
    "glance": "Indian-origin person abroad: born (self/parent/grandparent) in undivided India → may be registered as citizen by Indian diplomatic/consular representative.",
    "study": "Article 8 addresses the overseas Indian-origin population at commencement.\n\nConditions:\n- Person is ordinarily resident outside India.\n- Person, or either parent, or any grandparent, was born in India as defined in the Government of India Act, 1935 (as originally enacted).\n- Registration by the diplomatic or consular representative of India in the country where the person is residing, in the form and manner prescribed.\n\nEffect: such a registered person is entitled to citizenship rights under the Constitution.\n\nModern counterpart: registration and overseas citizenship frameworks under the Citizenship Act, 1955 (including OCI, which is not full citizenship). Article 8 itself is a commencement-era registration route.\n\nExamination: state birth-in-undivided-India link (self/parent/grandparent); registration by diplomatic/consular officer; distinguish from OCI under the 1955 Act.",
    "sections": [
      {
        "heading": "Key elements",
        "body": "1. Ordinary residence outside India.\n2. Indian origin via birth of self, parent or grandparent in undivided India (GoI Act 1935).\n3. Registration by Indian diplomatic or consular representative.",
        "order": 1
      }
    ],
    "questionsAndAnswers": [
      {
        "id": "art-8-brief",
        "draftingCategory": "brief",
        "question": "Explain Article 8.",
        "answer": "Article 8 provides that a person of Indian origin who is ordinarily residing outside India may be registered as a citizen of India by the diplomatic or consular representative of India in that country if the person, or either parent, or any grandparent was born in undivided India (as defined in the Government of India Act, 1935). It is a commencement-era overseas registration route; modern overseas status is largely under the Citizenship Act, 1955.",
        "relatedProvisionIds": ["constitution-article-8"]
      }
    ],
    "cases": [],
    "bareActPointers": ["Article 8", "Citizenship Act, 1955"],
    "examTips": ["Birth link: self / parent / grandparent in undivided India; registration by diplomatic/consular officer."],
    "legacySubjectSlug": "constitution",
    "legacyTopicId": "art-8",
    "migrationNote": "QUAL remediation 2026-10-09: overseas Indian-origin registration clarified.",
    "enhancement": {
      "version": "1.2.0",
      "status": "in-progress",
      "coverage": "substantive-topic-specific-v1",
      "caseLaw": [],
      "authoritativeSources": ["Constitution of India — Article 8"],
      "verification": {"lastVerifiedAt": null, "verifiedBy": null, "notes": ["Structure verified."]},
      "keyTakeaways": ["Art 8: overseas Indian-origin registration via diplomatic/consular representative."]
    }
  },
  "sources": ["source:india:india-code-constitution"],
  "updatedAt": "2026-10-09T03:25:00.000Z",
  "effectiveFrom": null,
  "effectiveTo": null,
  "tags": ["constitution", "citizenship", "overseas", "review-required"]
}
