{
  "schemaVersion": "v1",
  "entityType": "topic",
  "id": "topic:india:labour-css-s-51",
  "version": 1,
  "status": "published",
  "title": "Section 51 \u2014 Code on Social Security, 2020 provision (CSS s",
  "jurisdiction": "India",
  "content": {
    "overview": "Section 51 \u2014 Code on Social Security, 2020 provision (CSS s. 51). Complete Labour treatise with statutory deconstruction, examples, verified authorities, forum analysis and chamber drafting.",
    "study": "Topic at a glance\nSection 51 \u2014 Code on Social Security, 2020 provision (CSS s. 51) is a registered section in Labour & Industrial Law. Section 51 \u2014 Code on Social Security, 2020 provision (CSS s. 51) is governed by Code on Wages, 2019; Industrial Relations Code, 2020; Code on Social Security, 2020; and Occupational Safety, Health and Working Conditions Code, 2020, with legacy statutes applied only where savings or commencement rules preserve them. identify the Code and commencement notification actually in force for the dispute, the relevant date and forum; the Ministry source states that the Code on Social Security, 2020 was enforced on 21 November 2025, so do not apply a Code provision retrospectively without checking the applicable notification and savings rule.\n\nProvenance, purpose and doctrinal foundation\nThe topic exists to organise a legally enforceable rule, doctrine or professional procedure. Read the statutory text, constitutional setting, institutional purpose and binding authorities together. The correct analysis begins with the legal question and avoids replacing the governing enactment with a generic textbook summary.\n\nTextual anatomy and operative test\n1. Identify the governing enactment, section, article, rule, doctrine or professional standard named by the topic.\n2. Deconstruct definitions, conditions precedent, exceptions, provisos, explanations, jurisdictional limits and remedies.\n3. Distinguish the topic from its nearest neighbour: Section 1 \u2014 Code on Social Security, 2020 provision; Section 2 \u2014 Code on Social Security, 2020 provision; Section 3 \u2014 Code on Social Security, 2020 provision.\n4. Apply the rule to the record and state which fact satisfies or fails each ingredient.\n\nCourtroom and evidentiary roadmap\nCompetent forum: the appropriate Government, Labour Court, Industrial Tribunal, National Tribunal, civil court where jurisdiction survives, or constitutional court according to the dispute and statutory route. the party asserting workman status, industry, termination, retrenchment, unfair labour practice or wage entitlement must establish the foundational employment facts; statutory presumptions and records may shift evidentiary burdens. Where electronic records are relied upon, apply BSA 2023 s. 63 and the applicable burden provisions without treating electronic admissibility as proof of the ultimate fact. Identify limitation, notice, maintainability, alternative remedy and the exact relief sought.\n\nCurrent-law close\nCode on Wages, 2019; Industrial Relations Code, 2020; Code on Social Security, 2020; and Occupational Safety, Health and Working Conditions Code, 2020, with legacy statutes applied only where savings or commencement rules preserve them. identify the Code and commencement notification actually in force for the dispute, the relevant date and forum; the Ministry source states that the Code on Social Security, 2020 was enforced on 21 November 2025, so do not apply a Code provision retrospectively without checking the applicable notification and savings rule Always name the statute and provision in the final advice.",
    "relatedTopics": [],
    "illustrations": [],
    "legacySubjectSlug": "labour",
    "legacyTopicId": "css-s-51",
    "provenance": "Migrated from the existing codepackr-law topic file. Text was not rewritten."
  },
  "sources": [
    "source:india:india-code-constitution"
  ],
  "updatedAt": "2026-10-02T08:45:00Z",
  "effectiveFrom": "1950-01-26",
  "effectiveTo": null
}
