{
  "schemaVersion": "v1",
  "entityType": "topic",
  "id": "topic:india:constitution-art-242",
  "version": 2,
  "status": "review",
  "title": "Article 242 — Coorg (Omitted)",
  "jurisdiction": "India",
  "content": {
    "overview": "Article 242 dealt with the administration of Coorg as a distinct unit. It was omitted by the Constitution (Seventh Amendment) Act, 1956 (w.e.f. 1 November 1956) when Coorg was merged into the State of Mysore (now Karnataka) under States reorganisation.",
    "glance": "Art 242 omitted by 7th Amendment 1956 (w.e.f. 1-11-1956). Coorg merged into Mysore (Karnataka).",
    "study": "Article 242 provided for Coorg as a separate administrative unit under Part VIII arrangements.\n\nOmission: Constitution (Seventh Amendment) Act, 1956 (w.e.f. 1-11-1956), implementing States reorganisation; Coorg was integrated into Mysore.\n\nExamination rule: Do not cite Article 242 as living law. Coorg (Kodagu) is part of Karnataka.",
    "sections": [
      {
        "heading": "Constitutional status",
        "body": "Omitted by the 7th Amendment, 1956 (w.e.f. 1-11-1956). Coorg ceased to be a separate constitutional unit and became part of Mysore (Karnataka).",
        "order": 1
      }
    ],
    "questionsAndAnswers": [
      {
        "id": "art-242-status",
        "draftingCategory": "brief",
        "question": "What is the status of Article 242?",
        "answer": "Article 242 was omitted by the Constitution (Seventh Amendment) Act, 1956 (w.e.f. 1-11-1956) when Coorg was merged into Mysore. It is not living law.",
        "relatedProvisionIds": ["constitution-article-242"]
      }
    ],
    "cases": [],
    "bareActPointers": ["Article 242 (omitted — 7th Amendment, 1956)"],
    "examTips": ["Link Coorg merger to States Reorganisation Act / 7th Amendment."],
    "legacySubjectSlug": "constitution",
    "legacyTopicId": "art-242",
    "migrationNote": "Remediated 2026-10-09: accurate 7th Amendment omission and Coorg merger.",
    "enhancement": {
      "version": "1.2.0",
      "status": "in-progress",
      "coverage": "substantive-topic-specific-v1",
      "caseLaw": [],
      "authoritativeSources": ["Constitution (Seventh Amendment) Act, 1956"],
      "verification": {"lastVerifiedAt": null, "verifiedBy": null, "notes": ["Omission by 7th Amendment w.e.f. 1-11-1956."]},
      "keyTakeaways": ["Art 242 omitted by 7th Amendment, 1956; Coorg → Mysore/Karnataka."]
    }
  },
  "sources": ["source:india:india-code-constitution"],
  "updatedAt": "2026-10-09T03:15:00.000Z",
  "effectiveFrom": null,
  "effectiveTo": "1956-11-01",
  "tags": ["constitution", "omitted", "7th-amendment", "coorg", "review-required"]
}
