{
  "schemaVersion": "v1",
  "entityType": "illustration",
  "id": "illustration:india:arbitration-arbitration-uncitral-model-law-example",
  "version": 1,
  "status": "review",
  "title": "UNCITRAL Model Law on International Commercial Arbitration - educational example",
  "jurisdiction": "India",
  "content": {
    "type": "example",
    "body": "Educational example, not an official statutory illustration and not a decided case. Use only the law already recorded in this topic file. Recorded point for UNCITRAL Model Law on International Commercial Arbitration: UNCITRAL Model Law on International Commercial Arbitration. Complete ADR treatise with statutory deconstruction, examples, verified authorities, forum analysis and chamber drafting. Working point already in this file: Arbitration and Conciliation Act, 1996; Mediation Act, 2023; Legal Services Authorities Act, 1987; UNCITRAL Model Law on International Commercial Arbitration; BSA s. 63 and ss. 104, 109 where relevant If the facts meet that recorded point, apply it and stop. Do not add a case name or citation that is not already in this topic file.",
    "parentId": "topic:india:arbitration-uncitral-model-law",
    "officialStatutoryIllustration": false,
    "subject": "arbitration"
  },
  "sources": [],
  "updatedAt": "2026-10-04T01:09:19.214Z"
}
