{
  "schemaVersion": "v1",
  "entityType": "illustration",
  "id": "illustration:india:arbitration-arbitration-s-36-example",
  "version": 1,
  "status": "review",
  "title": "Section 36 Arbitration Act — Enforcement - educational example",
  "jurisdiction": "India",
  "content": {
    "type": "example",
    "body": "Educational example, not an official statutory illustration and not a decided case. Use only the law already recorded in this topic file. Recorded point for Section 36 Arbitration Act — Enforcement: An award is enforced as a decree under the CPC. A section 34 petition does not automatically stay execution. Working point already in this file: Section 36 Arbitration Act — Enforcement If the facts meet that recorded point, apply it and stop. Do not add a case name or citation that is not already in this topic file.",
    "parentId": "topic:india:arbitration-s-36",
    "officialStatutoryIllustration": false,
    "subject": "arbitration"
  },
  "sources": [
    "source:india:india-code-arbitration-1996"
  ],
  "updatedAt": "2026-10-04T01:08:54.513Z"
}
