{
  "schemaVersion": "v1",
  "entityType": "topic",
  "id": "topic:india:land-rfctlarr-s-19",
  "version": 1,
  "status": "review",
  "title": "RFCTLARR Act, 2013 \u2014 Section 19 (Publication of declaration and summary of Rehabilitation and Resettlement)",
  "jurisdiction": "India",
  "content": {
    "overview": "Section 19 of the Right to Fair Compensation and Transparency in Land Acquisition, Rehabilitation and Resettlement Act, 2013 deals with publication of declaration and summary of rehabilitation and resettlement.",
    "glance": "Section 19 of the Right to Fair Compensation and Transparency in Land Acquisition, Rehabilitation and Resettlement Act, 2013 deals with publication of declaration and summary of rehabilitation and resettlement.",
    "study": "RFCTLARR Act, 2013, section 19: Publication of declaration and summary of Rehabilitation and Resettlement. Apply the section with the acquisition, compensation and rehabilitation scheme of the Act. Verify the enacted heading before formal citation.",
    "sections": [
      {
        "heading": "Operative rule",
        "body": "Section 19 of the Right to Fair Compensation and Transparency in Land Acquisition, Rehabilitation and Resettlement Act, 2013 deals with publication of declaration and summary of rehabilitation and resettlement.",
        "order": 1
      }
    ],
    "provisions": [
      {
        "actName": "RFCTLARR Act, 2013",
        "provisionId": "rfctlarr-s-19",
        "section": "Section 19",
        "title": "RFCTLARR Act, 2013 \u2014 Section 19 (Publication of declaration and summary of Rehabilitation and Resettlement)"
      }
    ],
    "bareActPointers": [
      "RFCTLARR Act, 2013, Section 19"
    ],
    "examples": [],
    "hypotheticals": [],
    "examTips": [
      "State the section and the operative rule. Verify the enacted heading before formal citation."
    ],
    "caseLawGate": "not-locked"
  },
  "sources": [
    "source:india:india-code-income-tax-1961"
  ],
  "updatedAt": "2026-10-13T10:30:00.000Z",
  "effectiveFrom": null,
  "effectiveTo": null,
  "tags": [
    "land",
    "rfctlarr-s-19",
    "rfctlarr"
  ]
}
