{
  "schemaVersion": "v1",
  "entityType": "topic",
  "id": "topic:india:constitution-art-214",
  "version": 2,
  "status": "review",
  "title": "Article 214 — High Courts for States",
  "jurisdiction": "India",
  "content": {
    "overview": "Article 214 provides that there shall be a High Court for each State.",
    "glance": "There shall be a High Court for each State.",
    "study": "Article 214 is the constitutive provision for High Courts. Article 231 allows Parliament to establish a common High Court for two or more States or for two or more States and a Union territory. Certain Union territories are under designated High Courts by parliamentary law.\n\nExamination: one HC per State as the rule; common HC under Art 231; UT coverage by law.",
    "sections": [
      {
        "heading": "Key rule",
        "body": "There shall be a High Court for each State. Parliament may provide a common High Court for two or more States (Art 231).",
        "order": 1
      }
    ],
    "questionsAndAnswers": [
      {
        "id": "art-214-brief",
        "draftingCategory": "brief",
        "question": "What does Article 214 provide?",
        "answer": "Article 214 provides that there shall be a High Court for each State. Under Article 231, Parliament may by law establish a common High Court for two or more States or for two or more States and a Union territory.",
        "relatedProvisionIds": [
          "constitution-article-214",
          "constitution-article-231"
        ]
      }
    ],
    "cases": [],
    "bareActPointers": [
      "Article 214",
      "Article 231"
    ],
    "examTips": [
      "HC for each State; common HC under Art 231."
    ],
    "legacySubjectSlug": "constitution",
    "legacyTopicId": "art-214",
    "migrationNote": "QUAL remediation 2026-10-09.",
    "enhancement": {
      "version": "1.2.0",
      "status": "in-progress",
      "coverage": "substantive-topic-specific-v1",
      "caseLaw": [],
      "authoritativeSources": [
        "Constitution of India — Article 214"
      ],
      "verification": {
        "lastVerifiedAt": null,
        "verifiedBy": null,
        "notes": [
          "Text verified."
        ]
      },
      "keyTakeaways": [
        "Art 214: High Court for each State."
      ],
      "examAnswerStructure": {
        "shortAnswer": [
          "State art-214",
          "Identify elements",
          "Conclude"
        ],
        "tenMark": [
          "Text / rule",
          "Elements",
          "Application"
        ],
        "sixteenMark": [
          "Full framework",
          "Elements",
          "Application",
          "Conclusion"
        ]
      },
      "detailedExplanation": "Article 214 provides that there shall be a High Court for each State."
    },
    "examples": [
      {
        "title": "Application of art-214",
        "body": "Facts that satisfy the elements stated in the provision produce the consequence described in the text."
      }
    ],
    "hypotheticals": [
      {
        "question": "Do the facts engage art-214?",
        "analysis": "Compare the facts with the statutory or constitutional elements stated in the text."
      }
    ],
    "distinctions": [
      {
        "title": "Scope of art-214",
        "body": "Applies only within the elements and consequences stated in the constitutional text."
      }
    ],
    "misconceptions": [
      {
        "myth": "art-214 creates unlimited or extra-textual rights.",
        "correction": "It operates only as stated in the constitutional provision."
      }
    ],
    "revisionPoints": [
      "Core rule of art-214",
      "Elements",
      "Consequence"
    ]
  },
  "sources": [
    "source:india:india-code-constitution"
  ],
  "updatedAt": "2026-10-09T04:30:00.000Z",
  "effectiveFrom": null,
  "effectiveTo": null,
  "tags": [
    "constitution",
    "high-court",
    "review-required"
  ]
}
