{
  "schemaVersion": "v1",
  "entityType": "topic",
  "id": "topic:india:contract-s-48",
  "version": 1,
  "status": "review",
  "title": "Indian Contract Act, 1872 — Section 48 (Application for performance on certain day to be at proper time and place)",
  "jurisdiction": "India",
  "content": {
    "overview": "Section 48 of the Indian Contract Act, 1872 is headed \"Application for performance on certain day to be at proper time and place\". This catalog record identifies the provision. The enacted text, amendment status and any case law must be checked against the official India Code text before reliance.",
    "sections": [
      {
        "heading": "Section 48",
        "body": "Application for performance on certain day to be at proper time and place"
      }
    ],
    "examples": [],
    "hypotheticals": [],
    "relatedTopics": [],
    "relatedJudgments": [],
    "illustrations": [],
    "legacySubjectSlug": "contract",
    "legacyTopicId": "s-48",
    "bareActPointers": [
      "Indian Contract Act, 1872, s. 48"
    ],
    "migrationNote": "Created to close the catalog-to-canonical gap for generated Contract section topics. Not a verified statutory extract."
  },
  "sources": [
    "source:india:india-code-indian-contract-act-1872"
  ],
  "updatedAt": "2026-10-13T11:35:00.000Z",
  "effectiveFrom": null,
  "effectiveTo": null,
  "tags": [
    "contract",
    "indian-contract-act-1872",
    "section-48",
    "review"
  ]
}
