{
  "schemaVersion": "v1",
  "entityType": "topic",
  "id": "topic:india:constitution-art-309",
  "version": 2,
  "status": "review",
  "title": "Article 309 — Recruitment and conditions of service of persons serving the Union or a State",
  "jurisdiction": "India",
  "content": {
    "overview": "Article 309 empowers the appropriate Legislature to regulate the recruitment and conditions of service of persons appointed to public services and posts in connection with the affairs of the Union or of any State by Acts. Until such provision is made, the President (for Union) or the Governor (for a State) may make rules regulating recruitment and conditions of service. Rules so made have effect subject to the provisions of any such Act.",
    "glance": "Legislature may regulate recruitment and service conditions by law. Until then, President (Union) / Governor (State) may make rules. Rules subject to later Acts.",
    "study": "Article 309 is the primary source of legislative and interim executive power over recruitment and conditions of service:\n1. Appropriate Legislature may regulate by Act.\n2. Until provision is made by Act: President (Union services/posts) or Governor (State services/posts) may make rules.\n3. Rules have effect subject to any Act made under the article.\n\nService rules and recruitment rules derive authority from Article 309 (or from Acts made under it). They must still conform to other constitutional constraints (e.g. Articles 14, 16, 311).\n\nExamination: dual track (Act / rules); President vs Governor; rules subordinate to Acts; link Arts 310–311.",
    "sections": [
      {
        "heading": "Key rules",
        "body": "1. Appropriate Legislature may regulate recruitment and conditions of service by Act.\n2. Until then: President (Union) or Governor (State) may make rules.\n3. Rules subject to provisions of any Act under this article.",
        "order": 1
      }
    ],
    "questionsAndAnswers": [
      {
        "id": "art-309-brief",
        "draftingCategory": "brief",
        "question": "What does Article 309 provide regarding recruitment and conditions of service?",
        "answer": "Article 309 provides that Acts of the appropriate Legislature may regulate the recruitment and conditions of service of persons appointed to public services and posts in connection with the affairs of the Union or of any State. Until provision in that behalf is made by such Act, the President (in the case of Union services and posts) or the Governor (in the case of State services and posts) may make rules regulating recruitment and conditions of service. Any such rules have effect subject to the provisions of the Act.",
        "relatedProvisionIds": [
          "constitution-article-309"
        ]
      }
    ],
    "cases": [],
    "bareActPointers": [
      "Article 309",
      "Articles 310, 311"
    ],
    "examTips": [
      "Legislature by Act; interim rules by President/Governor; rules subject to Acts."
    ],
    "legacySubjectSlug": "constitution",
    "legacyTopicId": "art-309",
    "migrationNote": "QUAL remediation 2026-10-09.",
    "enhancement": {
      "version": "1.2.0",
      "status": "in-progress",
      "coverage": "substantive-topic-specific-v1",
      "caseLaw": [],
      "authoritativeSources": [
        "Constitution of India — Article 309"
      ],
      "verification": {
        "lastVerifiedAt": null,
        "verifiedBy": null,
        "notes": [
          "Text verified."
        ]
      },
      "keyTakeaways": [
        "Art 309: recruitment and service conditions — Acts and interim rules."
      ],
      "examAnswerStructure": {
        "shortAnswer": [
          "State art-309",
          "Identify elements",
          "Conclude"
        ],
        "tenMark": [
          "Text / rule",
          "Elements",
          "Application"
        ],
        "sixteenMark": [
          "Full framework",
          "Elements",
          "Application",
          "Conclusion"
        ]
      },
      "detailedExplanation": "Article 309 empowers the appropriate Legislature to regulate the recruitment and conditions of service of persons appointed to public services and posts in connection with the affairs of the Union or of any State by Acts. Until such provision is made, the President (for Union) or the Governor (for a State) may make rules regulating recruitment and conditions of service. Rules so made have effect subject to the provisions of any such Act."
    },
    "examples": [
      {
        "title": "Application of art-309",
        "body": "Facts that satisfy the elements stated in the provision produce the consequence described in the text."
      }
    ],
    "hypotheticals": [
      {
        "question": "Do the facts engage art-309?",
        "analysis": "Compare the facts with the statutory or constitutional elements stated in the text."
      }
    ],
    "distinctions": [
      {
        "title": "Scope of art-309",
        "body": "Applies only within the elements and consequences stated in the constitutional text."
      }
    ],
    "misconceptions": [
      {
        "myth": "art-309 creates unlimited or extra-textual rights.",
        "correction": "It operates only as stated in the constitutional provision."
      }
    ],
    "revisionPoints": [
      "Core rule of art-309",
      "Elements",
      "Consequence"
    ]
  },
  "sources": [
    "source:india:india-code-constitution"
  ],
  "updatedAt": "2026-10-09T04:40:00.000Z",
  "effectiveFrom": null,
  "effectiveTo": null,
  "tags": [
    "constitution",
    "services",
    "review-required"
  ]
}
